{
  "schema_version": "1",
  "brief_id": "demo-handoff-brief",
  "surface": "cli",
  "goal": "Continue the resurrection demo after Agent A lost chat context",
  "relevant_artifacts": [
    {
      "kind": "file",
      "identifier": "tests/test_ambient_context.py",
      "summary": "file_focus: tests/test_ambient_context.py",
      "relevance": 0.8
    },
    {
      "kind": "file",
      "identifier": "packages/devcd-core/src/devcd/slices/ambient_context/service.py",
      "summary": "file_focus: packages/devcd-core/src/devcd/slices/ambient_context/service.py",
      "relevance": 0.8
    }
  ],
  "git_context": {
    "branch": "main",
    "latest_commit": null,
    "latest_commit_summary": null,
    "repository": "."
  },
  "last_attempt": {
    "summary": "make check still fails: do_not_repeat is absent",
    "outcome": "failure",
    "source": "task",
    "type": "test_failure",
    "timestamp": "2026-05-04T12:06:00+00:00"
  },
  "last_failure": "make check still fails: do_not_repeat is absent",
  "why_attempt_failed": "The latest failure happened after the attempted fix, so the fix did not resolve the blocker: make check still fails: do_not_repeat is absent",
  "do_not_repeat": [
    "Do not repeat the last attempted fix unchanged: Added only a Last failure section to the markdown renderer"
  ],
  "blockers": [
    {
      "summary": "make check still fails: do_not_repeat is absent",
      "confidence": 0.8
    }
  ],
  "suggested_next_action": "Add a first-class resurrection context before rendering",
  "policy_summary": {
    "allowed": true,
    "operation": "export",
    "reason": "local context export to 'cli' is allowed by policy; surface 'cli' allows state areas summary, active_goal, active_intent, relevant_artifacts, git_context, open_loops, recent_attempts, blockers, suggested_next_steps and memory scopes working",
    "withheld_sources": [
      "browser"
    ],
    "withheld_data_classes": []
  },
  "withheld_context_summary": [
    {
      "category": "sensitivity",
      "policy_reason": "sensitive events are denied by the default local policy",
      "safe_summary": "notes note_update signal was withheld; only source/type metadata is visible as a safe replacement."
    },
    {
      "category": "sensitivity",
      "policy_reason": "sensitive events are denied by the default local policy",
      "safe_summary": "task test_output signal was withheld; only source/type metadata is visible as a safe replacement."
    },
    {
      "category": "payload_content",
      "policy_reason": "metadata-only policy denied full-text payload content",
      "safe_summary": "notes prompt_injection signal was withheld; only source/type metadata is visible as a safe replacement."
    },
    {
      "category": "source",
      "policy_reason": "source is not enabled by policy",
      "safe_summary": "browser url_focus signal was withheld; only source/type metadata is visible as a safe replacement."
    },
    {
      "category": "sensitivity",
      "policy_reason": "sensitive events are denied by the default local policy",
      "safe_summary": "notes user_hint signal was withheld; only source/type metadata is visible as a safe replacement."
    }
  ],
  "context_quality_notes": [],
  "unknowns": [
    "Original chat history is not available in the handoff packet."
  ],
  "confidence": 0.6
}